{"aggregateVerdict":"YELLOW","appAssemblyCalls":0,"approvedDecisionBriefSha256":"sha256:89a4f1b3d6e7507691b5719ad3edcbdf45b901bff25a3b71fdda1fce2dbca3f2","approvedProposalHead":"a45ea061e8e92f247597787e36ecfe52740b216a","approvedProposalTree":"89b28903fc34e985a17e8f3fdc4bfd7d0972880e","bindingInputAbsent":true,"candidateHandoffs":0,"cleanupStatus":"GREEN","codesignCalls":0,"codexPortSha256":"sha256:1ee5102b4d5a01b3a996a75a89b132ba115ef2b7680bd295c5b4f0514cb8b91d","codexProfileSha256":"sha256:0c6dc1dda5c97f9d3773bc2ccbd49b28c8ba1b02f7f6b55180db7b2672a9d2ce","constructedFileCount":48,"constructedFilesAggregateSha256":"sha256:924495e183caec3c367fba9f7d821c8af28f0d07f76394bf864e09e43c7f8c49","constructionJournalAbsent":true,"constructionOwnerReviewSha256":"sha256:27c64b28a19969f2d808870d64ad60fbd8b9bdf6b5343fa5d56aa719dd241ff9","constructionPacketSha256":"sha256:7ad7fd34d618b03b0cafffbe1b65c9516e0bd3bdcc0e329408f1d85e38669d06","constructionRunRootAbsent":true,"deterministicStressRuns":3,"dockerMutationCalls":0,"dockerReadOnlyCliCalls":0,"fakeChildStarts":72989,"fakeProcessGroupsAbsent":true,"firstProviderCallGrant":"NOT_REQUESTED","generatedAt":"2026-08-08T10:24:16Z","gitPushCommands":0,"githubIssueUpdatesPlanned":2,"githubIssuesUpdated":0,"helperLaunches":0,"hostBindingAdapterConstructionGrant":"APPROVED","hostBindingAttempted":true,"hostBindingCapsuleSha256":null,"hostBindingExpiresAt":null,"hostBindingId":null,"hostBindingModuleSha256":"sha256:c8ab2c600faa7bd93f4bd6b9d1dda0c74b895523403ffc6bc8bb7284a3a0a929","hostBindingPublicReceiptSha256":null,"immutableCoreAggregateSha256":"sha256:f4bd00354f1c7cd330b421faec735efb83c4f0efbc5f18eabc39923b11d1733d","immutableFullAggregateSha256":"sha256:f290ba035efa2eb84d899bf67d4ffb03c523d88556ce96b66f4f3a2862159310","implementationHead":"92c6c3f8896494aed699671a04a93a09fb59087d","implementationTree":"cf2ce5567c601fff1ad709e565dde41cf9c3540d","localAuthenticationCalls":0,"localDockerUnixSocketRequests":0,"macosBuildRecipeSha256":"sha256:6685aa357222667b967d54bfa9dce7a54851ea13154121196b60b21b2cd1d17c","macosPhysicalCompileCalls":0,"macosPhysicalContractSha256":"sha256:484e6b1f4bb8822ac80f50ac9fc103f8201b4ffe81e5211ae53ac65715e4ac1f","macosReadOnlyInspectionCalls":0,"normalCompilerTestStarts":2,"offlineTestFiles":54,"offlineTestsPassed":468,"packageLockSha256":"sha256:d7a56f2e40ffc80f03413c8e697e1a9a9199dcb8873cedc43cd421a2b265c812","physicalPortSha256":"sha256:284ba2146e20909324d7ef90afedb5e2ffac55d04ed8941299d8b8758a912b91","physicalRunnerSha256":"sha256:ddca9a6433d9eec1af581543ef23b329bc32164d87807f3ed6d9c74e892cf7e2","postgresCalls":0,"postgresExecutableCases":16,"postgresExpected2xx":39,"postgresExpectedControlledNon2xx":29,"postgresExpectedCoreCalls":68,"postgresExpectedNewReceipts":37,"postgresMigrationSha256":"sha256:4090ada09f8f0080ba503e32c3a4be271d3e3d1169b5957ef5ed77778f565be0","postgresNamedFamilies":13,"postgresOrderedExecutions":32,"postgresPersistedVerifierPlans":32,"postgresRaceByteIndexSha256":"sha256:3844ece0645e7c686ab51ef253511a0f49abb5f32936b5553b6882a7b23f17a6","postgresRaceCatalogSha256":"sha256:b37d981917e78742d30610bfadb21a5c80ed1563fddbd1178220535ef48dbef4","providerCalls":0,"publicationPushPlanned":1,"realCodexCalls":0,"reasonCode":"HOST_BOUND_PATH_SYMLINKED","retryExecutionGrant":"NOT_REQUESTED","sandboxExecCalls":0,"schemaVersion":"r4_gate_b_physical_adapter_construction_evidence.v1","securityCalls":0,"status":"HOST_BINDING_INCOMPLETE_YELLOW","threadStarts":0,"turnStarts":0}
